<?xml version="1.0" encoding="UTF-8"?>
<programacion xmlns:xsi="http://www.w3.org/2001/XMLSchema-instance"
    xsi:noNamespaceSchemaLocation="ej5.xsd">


    <lenguaje>
        <nombre>Python</nombre>
        <creador>Guido van Rossum</creador>
        <anioCreacion>1991</anioCreacion>
        <descripcion>Python is a high-level, interpreted, and general-purpose programming language
            that emphasizes readability with its notable use of significant whitespace.</descripcion>
    </lenguaje>
    <lenguaje>
        <nombre>Java</nombre>
        <creador>James Gosling</creador>
        <anioCreacion>1995</anioCreacion>
        <descripcion>Java is a class-based, object-oriented programming language that is designed to
            have as few implementation dependencies as possible.</descripcion>
    </lenguaje>
    <lenguaje>
        <nombre>C++</nombre>
        <creador>Bjarne Stroustrup</creador>
        <anioCreacion>1985</anioCreacion>
        <descripcion>C++ is a general-purpose programming language created as an extension of the C
            programming language, or «C with Classes».</descripcion>
    </lenguaje>


</programacion>